{
  "schema_version": "1.0.0",
  "payload_type": "hook_metrics",
  "vertical": "fintech",
  "discrepancy_headline": "Is our reported fee revenue of $1.2M accurate?",
  "consequence": "A 20% fee revenue overstatement means $240K in phantom revenue on the P&L — this is a material misstatement that affects regulatory reporting and investor confidence.",
  "trust_cue": "Reviewed by BayesIQ Data Quality Team",
  "score": 81,
  "severity_level": "moderate"
}
