{
  "schema_version": "1.0.0",
  "payload_type": "hook_metrics",
  "vertical": "real_estate",
  "discrepancy_headline": "Is our reported collection rate actually 95% or is the data inflating it?",
  "consequence": "A 10%+ overstatement in collection rate masks $200K+ in uncollected rent, directly impacting LP distributions and investor confidence.",
  "trust_cue": "Reviewed by BayesIQ Data Quality Team",
  "score": 65,
  "severity_level": "warning"
}
