{
  "schema_version": "1.0.0",
  "payload_type": "hook_metrics",
  "vertical": "saas",
  "discrepancy_headline": "Is our reported MRR of $2.4M accurate or inflated by ghost accounts?",
  "consequence": "A 20%+ MRR overstatement means we're reporting $480K in phantom revenue — this affects fundraising valuations and could constitute material misstatement to investors.",
  "trust_cue": "Reviewed by BayesIQ Data Quality Team",
  "score": 64,
  "severity_level": "warning"
}
